<xs:schema xmlns:xs="http://www.w3.org/2001/XMLSchema">

    <xs:element name="data">
        <xs:complexType>
            <xs:sequence>
                <xs:element name="skill" type="NamedEntry" maxOccurs="unbounded"/>
            </xs:sequence>
        </xs:complexType>
        <xs:unique name="uniqueSkillId">
            <xs:selector xpath="skill"/>
            <xs:field xpath="@id"/>
        </xs:unique>
    </xs:element>

    <xs:complexType name="NamedEntry">
        <xs:simpleContent>
            <xs:extension base="xs:string">
                <xs:attribute name="id" type="xs:string" use="required"/>
            </xs:extension>
        </xs:simpleContent>
    </xs:complexType>

</xs:schema>